,Unnamed: 0,Unnamed: 0.1,Unnamed: 0.1.1,Unnamed: 0.1.1.1,Unnamed: 0.1.1.1.1,urls,authors,dates,headlines,contents
32,32.0,,,,,https://www.philstar.com/cebu-news/2021/03/03/2081617/600-vsmmc-workers-set-vaccination-thursday-sinovac-vaccines-arrive-cebu,Mitchelle L. Palaubsanon,"March 3, 2021 - 12:00am",600 VSMMC workers set for vaccination thursday: Sinovac vaccines arrive in Cebu,"CEBU, Philippines —&nbsp; At least 7,200 doses of China’s Sinovac vaccine have arrived in Cebu on Tuesday, March 02, 2021, and were brought straight to the Vicente Sotto Memorial Medical Center where around 600 health care workers have agreed to get inoculated against COVID-19.Department of Health (DOH)-7 chief pathologist and spokesperson said 7,000 more doses are expected to arrive in Cebu between March 4 to 8.Up to 14,000 doses have been allocated for health care workers in Cebu but in a meeting with President Rodrigo Duterte on Monday, the country’s vaccine czar, Sec. Carlito Galvez, said the national government will add more doses for Cebu.      “Yung Region 7, padagdagan po natin kasi tumataas po kasi ang kanilang kaso po doon at tsaka may mga variants na po doon, so padagdagan po natin,” he said.Dr. Gerardo Aquino, Jr., VSMMC chief of hospital, said they wanted to have 2,900 health workers to get the vaccine but several have expressed apprehension against Sinovac.      Loreche said that the doses that will not be used in Cebu will be given to other hospital health care workers in the region retained by DOH.Dr. Van Philip Baton, DOH-7 medical coordinator for infectious diseases, called on the public to give the vaccine a chance as it work and proven to be effective, safe, and has saved lives.He said vaccination is the only way for the country to achieve herd immunity once a large portion of the population is inoculated.Dr. Junjie Zuasula, head of DOH-7’s Regional Epidemiology and Surveillance Unit, echoed Baton’ statement.“Achieving herd immunity will take time. It will also depend on the supply of vaccines. But one thing is certain – we will achieve herd immunity in due time,” Zuasula said during a forum of the Office of the Presidential Assistant for the Visayas (OPAV).Emotional ArrivalRetired Major General Melquiades Feliciano, Visayas implementer of the Inter-Agency Task Force, had volunteered to be vaccinated on March 4.He described the arrival of the vaccine at the Mactan Cebu International Airport as being emotional.“Oo, medyo naging emotional dahil at long last, dumating. Diba, ito yung pinakahihintay natin? Masaya lang talaga, masaya, hindi lungkot,” Feliciano told The Freeman.His wife, Mia, said on Facebook: “Cried happy tears. Light at the end of the tunnel.”Feliciano said some doses will be given to workers in other government hospitals and, if there will be doses left, barangay health care workers can benefit.He is hoping that vaccines from AstraZenica will finally arrive in the Philippines.Assistant Secretary Jonji Gonzales of OPAV said Cabinet members and key IATF officials, including Galvez, Health Secretary Francisco Duque III, and Presidential spokesperson Harry Roque will be in Cebu tomorrow, March 4.Business SectorBusinessman Kenneth Cobonpue, chairperson of the Regional Development Council in Central Visayas, said the business sector is very eager for the vaccination.Cobonpue said getting people vaccinated is one of the best ways to revive the economy further, especially in Central Visayas where travel and tourism play a huge role in people’s income.But while the vaccines give a glimmer of hope, Loreche reminded the public to still observe minimum health protocols against COVID-19.China DonationSinovac’s CoronaVac is the third COVID-19 vaccine brand, aside from Pfizer-BioNTech and AstraZeneca, granted an emergency use authorization (EUA) by the country’s Food and Drug Administration (FDA).At least 600,000 doses of the Coronavac arrived in the Philippines on Sunday, February 28. The vaccines arrived at the Villamor Air Base in Pasay City on board a Chinese military plane.President Rodrigo Duterte viewed the crate containing the vaccine doses and inspected the actual vaccine vials before the vaccines were transported in at least six 40-footer trucks to cold chain storage facilities that include the Philippine General Hospital (PGH) and the Metropac Logistics in Marikina City.In an earlier report, Sinovac is among three vaccines being considered by Cebu City for its own vaccination program alongside Novavax/Covovax and AstraZenica.Novavax has a pending EUA application.The city is no longer considering Pfizer-BioNtech, the first vaccine to be given an EUA in the country, mainly due to storage concerns. — Caecent No ot-Magsumbol, JMO (FREEMAN)"
33,33.0,,,,,https://www.philstar.com/cebu-news/2021/03/03/2081619/cebu-city-get-astrazenica-covovax-vaccines,Caecent No-ot Magsumbol,"March 3, 2021 - 12:00am","Cebu City to get AstraZenica,  Covovax vaccines","CEBU, Philippines —&nbsp; The tripartite agreement among the Cebu City government, the national government, and vaccine manufacturers is now one inch closer to being materialized after the City Council has approved a resolution authorizing Mayor Edgardo Labella to send a letter of intent on the city’s choice of vaccine brands – AstraZenica and Covovax/Novavax.The resolution was sponsored by Councilors Raymond Garcia and Nestor Archival.“Where we are right now in the City Council and Mayor Labella is getting closer to a tripartite agreement. That is why yesterday’s session was monumental as we already agreed on a resolution that was authored by Garcia (and) Archival, bringing the letter of intent to Mayor Labella to the pharmaceuticals,” said Vice Mayor Michael Rama, the city’s lead convenor for vaccine rollout."" style=""display: none;"">Skip      The two vaccine brands which the City Council, the convenor body, and the multi-sectoral group have agreed to enter into an agreement with soon are AstraZenica and Covovax/Novavax.AstraZenica already has an Emergency Use Authorization while Covovax’s application is still under review.      Sinovac, while also given nod by the Cebu City government, is no longer an option since it is already under the national government’s vaccination program.“With regard to the Sinovac vaccine, since the national government has already purchased the same, the Cebu City government will wait for the guidelines as to how it should be implemented and distributed to the constituents, mindful (of) the latter’s right to choose which vaccine to receive,” part of the resolution states.Rama reiterated that the council is also open to other vaccine brands, such as Pfizer and Moderna, as long as they have secured an EUA, do not need ultra-cold storage, and the price is reasonable.“We are not limiting it to other vaccines if they get the FDA’s EUA. But we have to consider the costs and storage. It’s going to be a nightmare if it needs ultra-storage,” the vice mayor said.The City Council is expected to finalize the number of vaccines to be purchased before entering into a purchase agreement.The city government initially set aside P400 million for the purchase of vaccines against COVID-19.Meanwhile, the council also had initial discussions on the city’s vaccine priorities as well as vaccination sites, vaccinators, and other personnel needed in its vaccination program.The proposed vaccination drive-thru had also been scrapped after Dr. Ilya Abellanosa of the Cebu City Health Department said individuals that have been vaccinated need to be monitored yet for some time before being allowed to go home.Councilor Alvin Dizon also opened up on the possibility of having a “house-to-house” vaccination for seniors and PWDs which Abellanosa said is already being considered in their initial plan. — with Decemay P. Padilla, JMD (FREEMAN)"
34,34.0,,,,,https://www.philstar.com/headlines/2021/03/02/2081443/missed-march-1-arrival-astrazeneca-jabs-was-tentative-date-who-says-citing-bottlenecks,None,"March 2, 2021 - 4:01pm","Missed March 1 arrival of AstraZeneca jabs was tentative date, WHO says, citing bottlenecks","MANILA, Philippines — Supply and logistical challenges&nbsp;are delaying the delivery to the Philippines of half a million AstraZeneca doses obtained through the COVAX facility, an official from the World Health Organization said Tuesday.An initial 525,600 doses of the AstraZeneca COVID-19 vaccine was supposed to arrive in the Philippines Monday but the delivery was postponed due to a “global supply problem,” Health Secretary Francisco Duque III announced on Sunday.   Related Stories      Philippines starts COVID-19 vaccination campaign   Vaccine czar: No date yet for arrival of AstraZeneca and Pfizer vaccinesRabindra Abeyasinghe, WHO country representative, said in an interview with CNN Philippines that the March 1 schedule for the arrival of AstraZenec vaccine doses announced by government officials ""had [only] been identified as a tentative date.""&nbsp;      Abeyasinghe also said the requirements needed to receive AstraZeneca jabs from the global facility have been completed. But he stressed there are bottlenecks hampering the delivery of the doses like&nbsp;manufacturers being&nbsp;""unable to meet manufacturing targets, because these are biological processes, and they couldn't&nbsp;produce the quantities that they anticipated they could early on.""Logistics already being arrangedHe also identified logistical challenges as another reason for the delay of the shipment.      “We’re now anticipating a second bottleneck and that is delivery processes. These vaccines need to be transported, maintaining cold chain requirements and logistic handlers are having challenges in ensuring large shipments of vaccines across the world… Now this is causing a challenge,” Abeyasinghe said.“My understanding is that the consignments are ready and just the logistics arrangements are being made. So once we have a finalization and a confirmed itinerary for delivery, we will share that information,” he added.Asked if the delayed delivery was due to logistical concerns and not a supply problem, Abeyasinghe responded: “Right now, that’s what we’re made to understand.”Vaccine deliveries to the Philippines are being coordinated by the UNICEF, the WHO official also said.Vaccine czar Carlito Galvez Jr. said Monday that there is no definite date yet for the arrival of the AstraZeneca shots but he is hoping the shipment will come before the first quarter ends.Delayed Pfizer shipmentAbeyasinghe said the country’s “access to Pfizer vaccines may be delayed” but he expressed hope that the jabs will come “before the end of the month.”Officials have been saying the supplies of Pfizer shots are in high demand in many countries, with Galvez saying the country should not expect delivery anytime soon.Some 117,000 doses of Pfizer vaccine were expected to arrive by mid-February but the delivery got delayed. Officials attribute the delay due to the absence of an indemnification program.The Philippines finally kicked off its inoculation drive against COVID-19 Monday, with medical workers, government officials and uniformed personnel among the first in line to receive shots of CoronaVac, the vaccine developed by China’s Sinovac Biotech.But the vaccination campaign faces not only supply problem but also public reluctance to get the critical shots.&nbsp;— Gaea Katreena Cabico"
35,35.0,,,,,https://www.philstar.com/headlines/2021/03/02/2081445/adverse-events-after-immunization-common-doh-says-after-20-had-side-effects,Christian Deiparine,"March 2, 2021 - 3:55pm","Adverse events after immunization 'common,' DOH says after 20 had side effects","MANILA, Philippines — The health department on Tuesday said some 20 individuals who received the Sinovac experienced adverse effects but sought to stress that these are common after being inoculated.Vaccinations for the COVID-19 began in the Philippines on March 1 in several hospitals where the Chinese-made jabs were administered to health workers along with select government officials.   Related Stories      Donated Sinovac doses arrive in the Philippines   Philippines starts COVID-19 vaccination campaignIn a Laging Handa briefing, Health Undersecretary Maria Rosario Vergeire said 756 in total were vaccinated Monday, mostly medical personnel despite the Food and Drug Administration earlier advice&nbsp;against administering it to them.      She also said&nbsp;that the 20 who reported effects had ""minor and common symptoms."" These included headache, rashes and others who had a sudden increase in blood pressure.""Lahat po sila ay na-monitor and were managed accordingly,"" the health official said. ""Lahat po sila ay umuwi at wala pong in-admit sa hospital.""      (All of them were monitored and managed accordingly. They were also able to go home as no one was admitted to a hospital.)The health department also has a process for monitoring adverse events after immunization, Vergeire said. Those who received the jabs are made to stay in the vaccination site for half an hour in case of an immediate reaction.They&nbsp;will also&nbsp;be monitored for a year since all COVID-19&nbsp;vaccines are still under emergency use approval by countries, and no jabs have so far been approved for market use.In a separate briefing, Vergeire recognized that many still face ""fear-related"" symptoms, causing some to feel anxious over receiving the vaccine. But she sought to assure that the chances of having adverse effects are only minimal.""Dapat wala tayong ikatakot sa injection...at 'wag matakot magkaroon ng adverse reactions kasi napaka-mild po ng ibibigay na mga reaction nito,"" she said.(We should have nothing to fear for injections, as well as on having adverse reaction because these are only mild.)Government in the recent months up to the first arrival of the vaccines had to struggle with encouraging more Filipinos to receive the jabs, as surveys showed only a few were willing to take it on concerns about&nbsp;safety and efficacy.Some administration officials took the Sinovac in public in a ""symbolic"" vaccination on Monday in a bid to ramp up public confidence on the vaccines. But noticeably, some of those who earlier remarked that they would take the jabs suddenly could no longer take it — such as Health Secretary Francisco Duque III and President Rodrigo Duterte due to old age.&nbsp;— with reports from Gaea Katreena Cabico"
36,36.0,,,,,https://www.philstar.com/headlines/2021/03/02/2081427/fda-says-chinas-sinopharm-applied-emergency-use-covid-19-vaccine,Gaea Katreena Cabico,"March 2, 2021 - 12:27pm",FDA says China's Sinopharm applied for emergency use of COVID-19 vaccine,"MANILA, Philippines — China’s state-owned pharmaceutical company Sinopharm submitted an application for the emergency use of its COVID-19 vaccine in the Philippines, the country’s Food and Drug Administration said Tuesday.“An online application was filed yesterday afternoon and the FDA is checking the contents of the submission now,” FDA Director General Eric Domingo told Philstar.com.   Related Stories      FDA approves compassionate use license on vaccines for PSG personnel   FDA probe into PSG vaccine smuggling hits 'blank wall'Presidential spokesperson Harry Roque announced Monday that Sinopharm filed an application for EUA in the country. Domingo, however, said he had no information about the matter at the time.      The FDA chief earlier said it may take more than 21 days before the agency can decide on the application of the Chinese drugmaker.“Maybe a month, around four to six weeks because Sinopharm has yet to receive EUA from a stringent regulatory authority or from the World Health Organization,” Domingo said.      Sinopharm reported that its vaccine was 79.3% effective in preventing COVID-19, lower than the reported efficacy rates of Pfizer-BioNTech and Moderna of 95% and 94.1%, respectively.So far, only the vaccines of Pfizer-BioNTech, AstraZeneca and Sinovac Biotech have obtained emergency use authorization from the FDA. The EUA application of Russia’s Gamaleya Institute for its Sputnik V vaccine remains pending.Duterte’s preferenceThe jab developed by Sinopharm is the one preferred by President Rodrigo Duterte.It was the same vaccine used by members of the Presidential Security Group, special envoy to China Mon Tulfo, some “Cabinet-level” officials and a senator in an unauthorized vaccine activity last year.The FDA and the National Bureau of Investigation launched separate investigations into the illegal inoculations. But Domingo told ANC’s Matters of Fact that its probe into the smuggling of COVID-19 vaccines for use of the president’s guards has hit a “blank wall” due to the non-cooperation of PSG personnel.In February, the FDA issued a “compassionate use license” for Duterte’s security detail to take 10,000 Sinopharm jabs.&nbsp;The country finally began its COVID-19 vaccination campaign Monday, with health workers, government officials and uniformed personnel the first in the line to receive donated Sinovac shots."
37,37.0,,,,,https://www.philstar.com/headlines/2021/03/02/2081428/labor-unions-want-ban-no-vaccine-no-work-policy,None,"March 2, 2021 - 12:27pm","Labor unions want ban on ‘no vaccine, no work’ policy","MANILA, Philippines — The biggest group of labor unions in the country wants the government to ban what it described as an “emerging” policy of some businesses requiring their employees to be vaccinated against COVID-19 before they are allowed to return to work.The Associated Labor Unions (ALU) said Tuesday that the “no vaccination, no work” policy is “discriminatory and coercive.”   Related Stories      Philippines starts COVID-19 vaccination campaign“Employees, either in private or in government, must never ever be subjected to any compulsion. The decision of any person not be vaccinated should be respected in the same way we respect those who had taken the vaccine,” said Gerard Seno, ALU national executive vice president.      Seno said that employers should only try to persuade employees with the benefits and advantages of being vaccinated, but they should not coerce them to get the shot.ALU said that some factory workers have complained to them about how their superiors have told them that they would not be allowed to report to work unless they participate in the company-sponsored coronavirus vaccination drive.      It added that other business owners have given instructions to supervisors and managers to deem employees who do not get vaccinated against COVID-19 as unfit to work.It also said that another group of employees have been told that they would need to present a certification to prove that they have received a COVID-19 jab before they are allowed to work.Meanwhile, Iloilo City is mulling to mandate all employees in the city to get vaccinated against COVID-19 before they are allowed to work.“Before it becomes a norm, the Department of Labor and Employment must respond quickly to these surfacing abuses and provide immediate protection measure by outlawing these unfair and unjust treatment of employees,” Seno said.While the government targets to inoculate 60 million to 70 million people in the hopes of achieving herd immunity, it is not making COVID-19 vaccines mandatory. — Xave Gregorio"
38,38.0,,,,,https://www.philstar.com/headlines/2021/03/02/2081422/fda-probe-psg-vaccine-smuggling-hits-blank-wall,None,"March 2, 2021 - 11:20am",FDA probe into PSG vaccine smuggling hits 'blank wall',"MANILA, Philippines — The Food and Drug Administration admitted Tuesday that its investigation into the smuggling of coronavirus vaccines for use by President Rodrigo Duterte’s guards has hit a “blank wall” as the Presidential Security Group is not cooperating in the probe.“We’re not getting any information, the DOH (Department of Health) is not getting information,” FDA Director General Eric Domingo told ANC’s Matters of Fact.   Related Stories      Duterte tells PSG to 'shut up' on use of smuggled COVID-19 vaccines during probe   FDA approves compassionate use license on vaccines for PSG personnel   Mon Tulfo admits getting inoculated with smuggled Sinopharm shots, eyes local distributorshipDespite this, Domingo said they are still continuing their investigation, gathering information from sources other than the PSG.Skip      He added that their focus now is to prevent the smuggling of vaccines from ever happening again.“Our focus really is in the Bureau of Customs, working with them to make sure there is no smuggling going on, especially now that we already have products coming in that are legal,” Domingo said.      Domingo previously told CNN Philippines’ The Source in January that Health Secretary Francisco Duque III wrote to the PSG asking for a list of who was vaccinated and what vaccine was given to them, but Duterte’s guards reportedly did not respond.This is despite assurance from Malacañang that the PSG will cooperate with the investigations of the FDA and the National Bureau of Investigation after Duterte told his guards to “shut up” in case they are hauled to congressional inquiry on their illegal vaccination.Duterte has fiercely defended the PSG’s inoculation with smuggled, unauthorized vaccines, while top government officials have encouraged the public to move on from the scandal that drew furor and calls for accountability from the public and lawmakers.But months since Duterte himself admitted that his guards, along with other military personnel, have been given the still-unauthorized Sinopharm shots, no one has been held accountable for smuggling the vaccines into the country.If anything, it has led to the FDA allowing the PSG to use Sinopharm vaccines and another brazen admission — this time from Duterte’s former special envoy to China, Ramon Tulfo — that certain top government officials have received the same jabs. &nbsp;Domingo said they are starting their investigation on Tulfo’s admission, but could not give an update as to its progress. — Xave Gregorio"
39,39.0,,,,,https://www.philstar.com/nation/2021/03/02/2081262/manila-start-covid-19-vaccination-today,Ghio Ong,"March 2, 2021 - 12:00am",Manila to start COVID-19 vaccination today,"MANILA, Philippines — The Manila city government received yesterday 3,000 doses of COVID-19 vaccine manufactured by Chinese drug firm Sinovac, according to Mayor Isko Moreno.He said they would start the vaccine rollout today by inoculating at least 200 health workers.“Hopefully, I’m going to be vaccinated tomorrow along with the directors of Manila hospitals and other medical frontliners,” Moreno told reporters. “Once we start the vaccination, siguradong dadami ang gustong magpabakuna.”      Manila was the first local government unit in the country to receive Sinovac vaccines from the National Task Force against COVID-19.Moreno, Vice Mayor Honey Lacuna and officials of the Sta. Ana Hospital received the vaccines at around 4 p.m.      Boxes of Sinovac vaccines were brought to the hospital’s cold storage facility.The vaccine doses would be good for the city’s 1,500 healthcare workers, including doctors, nurses and personnel working in public hospitals as well as barangay health workers, Moreno said.He said health workers have the right to choose other brands of COVID vaccine they prefer.“But we want to encourage them not to waste the opportunity of being the first to be vaccinated against COVID-19,” Moreno said.Related video:"
