,Unnamed: 0,Unnamed: 0.1,Unnamed: 0.1.1,Unnamed: 0.1.1.1,Unnamed: 0.1.1.1.1,urls,authors,dates,headlines,contents
17,17.0,17.0,17.0,,,https://www.philstar.com/headlines/2021/03/04/2081962/after-delays-first-astrazeneca-jabs-covax-arrive-philippines,Christian Deiparine,"March 4, 2021 - 7:37pm","After delays, first AstraZeneca jabs from COVAX arrive in Philippines","MANILA, Philippines (Updated 10:18 p.m.) — Initial doses of AstraZeneca under the COVAX facility arrived in Manila on Thursday night, the first delivery from the World Health Organization-led initiative that comes days into the country's vaccination efforts.A KLM Royal Dutch Airlines plane&nbsp;carrying some 487,200 doses landed at the Villamor Air Base in Pasay City by&nbsp;7:10 p.m., with officials set to officially receive the much-needed jabs at a time when nearly 585,000 Filipinos have contracted COVID-19 and with over 12,400 dead from the pandemic.   Related Stories      Palace says AstraZeneca jabs arriving March 4; vaccine czar not so sure   AstraZeneca jabs being eyed for elderly medical personnel, officials sayIn total, the Philippines is seen to receive 4.58 million doses of the AstraZeneca vaccines as part of its share from the COVAX facility, along with 117,000 doses of doses made by Pfizer.      Officials initially said 5.5 million of the British-Swedish drugmaker's doses were allocated&nbsp;for the country but this was&nbsp;changed recently per an allocation list published by the WHO.Speaking at a ceremony at the arrival of the vaccines, President Rodrigo Duterte reiterated his call to make the jabs accessible to many countries and encouraged Filipinos to get vaccinated as soon as they can. He also thanked the donor countries, which include members of the European Union, a bloc that he had cursed in the past for alleged interference in domestic issues.      ""I don't know how to express my gratitude to [you],"" he said. ""That you remembered the poor nations is in fact already a plus for humanity..I'd like to say again that we felt the gratitude in our hearts.""""May God bless you for your benevolence,"" he also said.WHO representative in the Philippines Rabindra Abeyasinghe, speaking at the brief ceremony, said that although vaccines have been arriving,&nbsp;preventive measures should not be abandoned. ""Nobody is safe until everyone is safe,"" he also said.The vaccines from the COVAX facility were expected to arrive in February, as the administration sought to give dates that later on turned out to be estimates.AstraZeneca's jabs secured emergency use approval from the Food and Drug Administration in late January&nbsp;after Pfizer did, and was followed by Sinovac.The government's vaccination program started this week with 600,000 doses donated&nbsp;by Beijing,&nbsp;the first to reach the Philippines last week,Taken in two doses, the AstraZeneca vaccine&nbsp;was found to be 70% effective on average. On Wednesday, however, a member of the OCTA Research team warned that its efficacy rate could decrease to just 10% against the new COVID-19 variant first seen in South Africa that has already been detected in the country.But the health department in a briefing earlier Thursday&nbsp;sought to allay such fears, saying the studies cited had a small sample of individuals.It came as South Africa halted the rollout of AstraZeneca after trials there showed a poor showing against combating the said variant. To which, Health Undersecretary Maria Rosario Vegeire said: ""No matter what the publications say that its efficacy has gone lower, until we are not certain, we will continue to use the vaccines.""The arrival marks an important step in the&nbsp;vaccination efforts in the country, as some health workers — first in line to receive the jabs — sought alternatives to Sinovac.Government said too that medical workers above 60&nbsp;could be prioritized to get Pfizer vaccines, since&nbsp;Sinovac is&nbsp;not recommended for senior citizens.All donations, none boughtCOVAX facility's allocation is different from the direct procurement by government to vaccine manufacturers.The European Union, for one, said it has provided € 2.2 billion to help countries gain access to vaccines, including the Philippines.In a statement, EU's ambassador to the country&nbsp;Luc Véron said the union ""has both a responsibility and interest to make vaccines available for all,"" adding that the union is the ""biggest contributor"" to the COVAX's donation to the country.To date, only term sheets have have been signed, with no purchase deals yet. The supplies from Sinovac and AstraZeneca are also donations.This means that despite officials' repeated pronouncements that the country will have enough supplies this year, the administration has yet to spend the allocated P72.5 billion meant to buy vaccines, funding that is from money borrowed from multilateral sources such as the World Bank."
18,18.0,18.0,18.0,,,https://www.philstar.com/headlines/2021/03/04/2081982/philippines-told-failure-follow-vaccine-priorities-could-jeopardize-share-covax-facility,Christian Deiparine,"March 4, 2021 - 7:20pm",Philippines told: Failure to follow vaccine priorities could jeopardize share in COVAX facility,"MANILA, Philippines — Lapses in vaccination priorities could risk the country's share in the COVAX facility, a World Health Organization official said Thursday.AstraZeneca's doses under the global initiative are set to arrive in the Philippines on Thursday night&nbsp;in what would boost the country's vaccination efforts that began in March 1 after figuring in delays.   Related Stories      'Bad precedent': Experts seek unlikely accountability over unauthorized vaccinations   FDA probe into PSG vaccine smuggling hits 'blank wall'   Palace says AstraZeneca jabs arriving March 4; vaccine czar not so sureBut Dr. Rabindra Abeyasinghe, the WHO's representative to the country, stressed that government's priority list should be followed, particularly health workers and the most vulnerable to the COVID-19.      ""To access these vaccines and then the remainder that will be coming to the Philippines before the end of the year, [it] needs to demonstrate that they can first rollout the vaccines in an efficient manner,"" he said in a briefing.Some 4.58 million doses of AstraZeneca and 117,000 doses of Pfizer are allocated for the country, with an initial delivery of 487,200 doses of the British-Swedish drugmaker arriving on Thursday night.      Abeyasinghe said a proper rollout will also include minimizing wastage of the jabs, as well as ensuring that storage management is done efficently.Line-jumping with smuggled vaccinesMembers of the Presidential Security Group were actually among the first in the country to be vaccinated against the coronavirus. They were vaccinated with&nbsp;unauthorized&nbsp;and smuggled Sinopharm vaccines in late 2020, President Rodrigo Duterte himself disclosed last December.The innoculation mess drew widespread criticism and calls for accountability, but local regulators said their investigation has hit a ""blank wall"" with no cooperation from the PSG. A similar probe into the use of the same smuggled vaccines by columnist Mon Tulfo, ""Cabinet-level"" officials and a senator are similarly likely to go nowhere.Medical experts warned that failing to hold someone responsible for the unauthorized vaccinations&nbsp;could set a bad precedent for bringing in medicines or other vaccines into the country.They also said that justifying the apparent disregard for the law could undermine vaccination efforts in the country, at a time when public mistrust of&nbsp;the jabs has&nbsp;remained high.Health workers are at the top of government's priority list to get the jabs. But only days into vaccinations, incidents of some officials receiving the jabs despite not being on&nbsp;the list have drawn flak.Later on sought for comment, presidential spokesperson in a briefing admitted ""breaches"" into the vaccination program.""Courtesy of these three incidents, everyone should now know that the first vaccines are only for medical frontliners,"" he said partly in Filipino. ""We are not perfect in carrying out protocols. We had a few breaches."""
19,19.0,19.0,19.0,,,https://www.philstar.com/headlines/2021/03/04/2081979/china-donate-400000-more-doses-covid-19-vaccines-duterte-says,Xave Gregorio,"March 4, 2021 - 6:52pm","China to donate 400,000 more doses of COVID-19 vaccines, Duterte says","MANILA, Philippines — President Rodrigo Duterte said Thursday that China will be donating 400,000 more doses of COVID-19 vaccines on top of its earlier donation of 600,000 doses of CoronaVac developed by Sinovac Biotech Ltd.“China will give us another 400 [thousand doses,] making their donation to their country 1 million [doses,]” Duterte said in a speech at the inauguration of school buildings in Valenzuela City.   Related Stories      Donated Sinovac doses arrive in the Philippines   Philippines to buy 1 million doses of Sinovac this MarchDuterte did not say from which vaccine maker the shots from China would come from, although a shipment of 600,000 doses of CoronaVac arrived in the Philippines last Monday, making them the first coronavirus vaccines to arrive in the country.Skip      Aside from the donations, the Philippines is also buying 1 milion doses of CoronaVac under a P700-million purchase deal.Apart from Sinovac, Chinese state-owned drugmaker China National Pharmaceutical Group Corp., Ltd. (Sinopharm) has also developed a coronavirus vaccine.      Only Sinovac’s CoronaVac has been authorized for emergency use by the Food and Drug Administration, while Sinopharm’s jab is still being reviewed by the drug regulator.There have been some fears, particularly from opposition lawmakers, that China is deploying vaccine diplomacy, or using its access to vaccines to force countries to bend to its will.Top government officials have downplayed these concerns, with Malacañang even saying that the donations would not affect the country’s territorial claims in the West Philippine Sea.China considers the West Philippine Sea, or the part of the South China Sea within the Philippines’ exclusive economic zone, as part of its territory despite a 2016 arbitral ruling that held that its territorial claims in the area have no legal basis.It also passed in January a new law that allows Chinese coast guard to fire at foreign vessels and demolish structures built on contested islands, which prompted the Department of Foreign Affairs to lodge a diplomatic protest and the Armed Forces of the Philippines to increase its naval presence in the West Philippine Sea.During the course of his administration, Duterte has made a remarkable pivot to China, warming up ties with the Asian giant.He has also made clear his preference for Chinese vaccines, especially for the still-unauthorized Sinopharm jabs.Smuggled Sinopharm vaccines were used to inoculate members of Duterte’s security group. Former special envoy to China Ramon Tulfo said he and other top government officials have had themselves inoculated with these same illegal shots. — with a report from Bella Perez-Rubio"
20,20.0,20.0,20.0,,,https://www.philstar.com/headlines/2021/03/04/2081989/duterte-says-lift-all-covid-19-restrictions-once-vaccines-widely-available,None,"March 4, 2021 - 6:42pm",Duterte says to lift all COVID-19 restrictions once vaccines widely available,"MANILA, Philippines — President Rodrigo Duterte said Thursday that he will “immediately” ease all restrictions imposed to curb the spread of COVID-19 once vaccines for the respiratory disease become widely available.“If I see most of the citizens can avail of the vaccine in any of the health centers, hospitals … then I will reopen everything in our economy,” Duterte said partly in Filipino in a speech at the inauguration of school buildings in Valenzuela City.   Related Stories      With vaccine rollout, Duterte eyes MGCQ for Metro ManilaIt is not clear, however, when this target will be reached. As it stands, the government eyes the “massive rollout” of COVID-19 vaccines in the third quarter of this year, but even then only up to 25 million Filipinos would get the jabs, far below the target of inoculating 50 million to 70 million Filipinos.      By Duterte’s own estimate, the country would not return to normal until “maybe first or second quarter of year … 2023.”The government’s own pandemic task force has recommended that the entire country shift to the laxest quarantine regime, only for Duterte to reject this due to the lack of a wider vaccine rollout.&nbsp;      Duterte, however, has indicated he is ready to place the country under modified general community quarantine once the country gets an adequate supply of COVID-19 vaccines — Xave Gregorio"
21,21.0,21.0,21.0,,,https://www.philstar.com/headlines/2021/03/04/2081952/astrazeneca-jabs-being-eyed-elderly-medical-personnel-officials-say,Christian Deiparine,"March 4, 2021 - 3:04pm","AstraZeneca jabs being eyed for elderly medical personnel, officials say","MANILA, Philippines — Government on Thursday said it is looking to vaccinate health workers who are also senior citizens with the AstraZeneca, whose doses are due to arrive in the country later tonight after figuring in delays.The delivery of 487,200 doses under the World Health Organization-led COVAX facility comes as the country is days into its inoculation efforts, with so far the Sinovac as the only choice.   Related Stories      Palace says AstraZeneca jabs arriving March 4; vaccine czar not so sureCabinet Secretary Karlo Nograles in a briefing recognized the Chinese-made jabs' limitation of only being recommended by the National Immunization Technical Advisory Group for 18 to 59-years-old.&nbsp;      This leaves out those 60 and above, including medical personnel who have continued in their duties.""The Astrazeneca vaccine has no limts on age,"" he said. ""So we will await for the advice of the NITAG [if] we can use this for senior citizens who are health workers and can't be inoculated with the Sinovac.""      Vaccinations in the Philippines began on March 1, with health workers the first to receive the jabs despite an earlier advice by the Food and Drug Administration against it.To date, Nograles said 8,559 have already been inoculated, which includes some administration officials in a bid to allay public concerns over Sinovac.Speaking to CNN Philippines' ""The Source,"" vaccine czar Carlito Galvez Jr. said too that doctors are pushing to prioritize elderly health workers to receive the AstraZeneca.He added that inoculations are already ongoing in 32 hospitals, with efforts soon expanding to Davao, Cagayan de Oro and Cebu City as more than 190,000 doses of Sinovac were already transported nationwide.The administration first said the jabs from the COVAX facility, that is AstraZeneca including 117,000 doses from Pfizer, will arrive in the country by February 15.&nbsp;But hopes by many for vaccines that have reported higher efficacy rates were met with delays due to the lack of an indemnity agreement.Latest allocation figures from the COVAX published showed that the Philippines is due to receive 4.58 million doses of AstraZeneca, from the earlier 5.5 million given by officials.Galvez, who yesterday was hesitant to confirm the arrival of the said jabs, told CNN Philippines as well that the delivery is slated by 7:30 p.m. tonight."
22,22.0,22.0,22.0,,,https://www.philstar.com/headlines/2021/03/04/2081830/year-after-first-local-case-san-juan-starts-vaccination,Neil Jayson Servallos,"March 4, 2021 - 12:00am","A year after first local case, San Juan starts vaccination","MANILA, Philippines — Two days before the hospital marks a year since handling the country’s first local COVID transmission, Cardinal Santos Medical Center (CSMC) in San Juan has begun vaccinating its health care workers.Three hospital personnel were the first to receive Sinovac jabs yesterday as a prelude to the CSMC’s mass vaccination of workers tomorrow, exactly a year after admitting the first case of community transmission in the country.Cardinal Santos Medical Center chief medical officer Dr. Zenaida Javier-Uy said they were targeting to inoculate 1,000 health workers, with 61 percent of the CSMC’s pool of physicians willing to take the China-made jabs despite their expectation to receive Pfizer’s vaccine.Skip      “A good 61 percent of our doctors confirmed for vaccination despite the fact they were all expecting the Pfizer vaccine. But when we said Sinovac, 61 percent said yes,” she said during the vaccination rites.Human resources chief Maria Louzel Diaz, orthopedics department chair Dr. Edgar Eufemio and internal medicine chief resident Dr. Sergie Fernandez received the jabs.      Eufemio was responsible for collaborating with the local government and Xavier School in setting up the Kalinga Center quarantine facility. Fernandez, meanwhile, was manning the emergency room at the height of the pandemic.Diaz, who made sure hospital staff were fed and sheltered during lockdown when transportation was very minimal in Metro Manila, said she volunteered to get vaccinated to boost the confidence of hospital employees and health workers.Mayor Francis Zamora, who was at the time quarantined at the CSMC after testing positive for COVID-19 on Monday, said an initial 300 doses were expected to be delivered to the hospital yesterday.“The vaccine rollout comes at a very significant time as almost one year ago, March 6, 2020, the DOH confirmed to me that the first local transmission in the Philippines was a patient from Cardinal Santos Medical Center,” he said in a statement sent to reporters.A 62-year-old man from Cainta, Rizal who had not traveled outside the country tested positive for COVID-19 on March 5 last year and was admitted to CSMC, making him the first recorded case of local transmission. His wife also tested positive for COVID-19, making her the second local case.The pair were transferred to the Research Institute for Tropical Medicine for treatment, where they died due to health complications brought by the virus after more than a week of battling the disease.“Now, one year after, our vaccination process has begun, which I believe will be the game changer in our fight against COVID-19,” Zamora added."
23,23.0,23.0,23.0,,,https://www.philstar.com/cebu-news/2021/03/04/2081912/lapu-lapu-first-city-central-visayas-hold-vaccination-dry-run,Mitchelle L. Palaubsanon,"March 4, 2021 - 12:00am",Lapu-Lapu first city in Central Visayas to hold vaccination dry run,"CEBU, Philippines — Lapu-Lapu City was the first city in Central Visayas to conduct a simulation exercise for the COVID-19 vaccination.A recipient of a coronavirus vaccine will go through six steps based on yesterday’s dry run in Barangay Pajo. Step 1, waiting area; step 2, registration; step 3, counselling; step 4, screening; step 5, vaccination; and step 6, post-vaccination.Department of Health-7 spokesperson Dr. Mary Jean Loreche said it was done to ensure smooth operations during vaccination.      “We did time stamping to know how long it will take for one vaccinee for the whole process and to check for any needs to improve upon,” she said.She said the entire process will be replicated in other identified community vaccination centers.      Mayor Junard ""Ahong"" Chan, in a Facebook post, said the city is now ready for the first phase of COVID vaccination.“Kini nagpasabot nga andam na ta alang sa phase 1 sa atong Covid-19 Vaccination Program diin mga frontline healthcare worker ang prayoridad,” he said.Phase one includes vaccination of frontline health workers, aged 18 to 59. They will receive the Sinovac.For the second phase, Chan said the priority vaccinees are drivers of public transport systems and market vendorsPersons with disabilities and indigents are included in the third phase of vaccination, while members of the Philippine National Police, Bureau of Fire Protection and Bureau of Jail Management and Penology are in fourth phase.Chan assured his constituents that the Sinovac’s Coronavax is “safe.”“Wala usab kamoy angay ikabalaka kabahin sa bayrunon kay libre man kini,” he added.While waiting for the arrival of vaccines in the city, he asked the pubic to continue observing the health protocols, such as wearing of face mask and face shield, washing of hands, and social distancing.“Mga kaigsuonan ko, hapit na gayud nato makab-ot ang atong gipangandoy nga kadaugan batok niining makalilisang nga sakit. Padayon ko nga nag-ampo sa kahitas-an nga unta mao na ni ang kasulbaran sa atong suliran,”&nbsp; the mayor said. — KQD (FREEMAN)"
24,24.0,24.0,24.0,,,https://www.philstar.com/cebu-news/2021/03/04/2081913/3-malls-offer-spaces-covid-19-vaccination,Mary Ruth R. Malinao,"March 4, 2021 - 12:00am",3 malls offer spaces for COVID-19 vaccination,"CEBU, Philippines — Three malls in Cebu City have offered their spaces for the city government to use as COVID-19 vaccination sites, said City Administrator Floro Casas, Jr.Casas, vice chairman of the city’s Vaccine Board, said they are already communicating with the respective mall owners, but nothing is final yet.The locations of the three malls are in the north and south.      Casas added the Vaccination Operations Center, which is already operational, is also considering churches, gyms, and schools as vaccination sites.He said the city government is considering these locations for the public to have a convenient area during the activity.      ""Para convenient pud sa mga magpa-vaccinate kay after man gud sa vaccination, mo-stay man gud ka for a while para obserbahan ka sa effect sa vaccine sa imong lawas,"" said Casas.""So, dapat comfortable pud sila. That’s why naningkamot ang Cebu City government makapangita og comfortable nga lugar,"" he added.City Health Department (CHD) officer-in-charge Jeffrey Ibones said malls are strategic areas for the vaccination considering that they have big spaces, which could cater to the different processes that would happen during the inoculation such as orientation, registration, screening, and monitoring of individuals.Ibones, chairman of the Vaccine Board, said these areas will still be checked.With regard to the vaccinators, he said the city government has at least 100 vaccinators who are under the CHD.“Ang CHD naa gyud ta’y vaccinators. Naa man ta’y regular nga vaccination gyud sa atong mga health centers. Mga nurses nato, midwife nato nga trained daan mo-vaccinate,” said Ibones.Ibones added that the city will also accept volunteers to help in the vaccination program. — KQD (FREEMAN)"
25,25.0,25.0,,,,https://www.philstar.com/headlines/2021/03/03/2081704/lacking-submission-fda-delays-review-sinopharm-covid-19-jab,Gaea Katreena Cabico,"March 3, 2021 - 3:22pm",Lacking submission to FDA delays review of Sinopharm COVID-19 jab,"MANILA, Philippines — The country’s Food and Drug Administration has yet to evaluate the application of Sinopharm for the emergency use of its COVID-19 vaccine due to incomplete documents.The application of Southmed Pharma, which seeks to the firm’s distributor in the Philippines, lacked documents such as clinical trial results and certificate of good manufacturing practice, FDA Director General Eric Domingo said. The local company also needs to present proof it is the distributor of Sinopharm in the country.&nbsp;   Related Stories      FDA says China's Sinopharm applied for emergency use of COVID-19 vaccine“Once they submit the documents, we will begin the evaluation,” Domingo said in a public briefing Wednesday.&nbsp;      “Until we see scientific evidence, we see the population involved in their Phase 3 clinical trials, their experience in using the vaccine in other countries, that’s the only time we can give recommendation on the use of the vaccine,” he added.The drug regulator confirmed Tuesday the receipt of an online application seeking emergency use authorization for the jab developed by China’s state-owned pharmaceutical company.      Domingo earlier said it may take “around four to six weeks” before the agency can decide on the application because Sinopharm has yet to receive EUA from a stringent regulatory authority or from the World Health Organization. The lack of relevant documents may delay it further.“We’re very objective in approving vaccines. We have a checklist of what we’re looking for: safety, efficacy and quality,” he said.Interim analysis of Phase 3 clinical trials showed that Sinopharm’s COVID-19 vaccine was 79.3% effective in preventing the disease, lower than the reported efficacy rates of Pfizer-BioNTech and Moderna of 95% and 94.1%, respectively. The data, however, have not been peer-reviewed.So far, only the vaccines of Pfizer-BioNTech, AstraZeneca and Sinovac Biotech have obtained EUAs from the FDA. The application of Russia’s Gamaleya for its COVID-19 vaccine remains pending.The jab developed by Sinopharm is the one preferred by President Rodrigo Duterte.It was the same vaccine used by members of the Presidential Security Group, special envoy to China Mon Tulfo, some “Cabinet-level” officials and a senator in an unauthorized vaccine activity last year.The country began its delayed COVID-19 vaccination campaign Monday, with health workers, government officials and uniformed personnel the first in the line to receive donated Sinovac shots."
