,Unnamed: 0,Unnamed: 0.1,Unnamed: 0.1.1,Unnamed: 0.1.1.1,Unnamed: 0.1.1.1.1,urls,authors,dates,headlines,contents
8,8.0,8.0,8.0,8.0,,https://www.philstar.com/headlines/2021/03/06/2082410/more-astrazeneca-vaccines-arriving-philippines-sunday,Xave Gregorio,"March 6, 2021 - 1:51pm",More AstraZeneca vaccines arriving in Philippines on Sunday,"MANILA, Philippines — The Philippines is set to receive Sunday evening more doses of the COVID-19 shot developed by British-Swedish drugmaker AstraZeneca with the University of Oxford, vaccine czar Carlito Galvez said.Galvez said 38,400 doses of the jab would arrive in the Philippines at around 7 p.m. onboard a commercial plane.   Related Stories      After delays, first AstraZeneca jabs from COVAX arrive in Philippines   Philippines detects 83 more cases of coronavirus variants first seen in UK, South AfricaThese doses form part of the World Health Organization-led COVAX facility’s pledge to initially deliver 525,600 doses to the Philippines as part of its commitment to give the country a total of 4.5 million doses of the shot by May.Skip      Malacañang initially announced that the all 525,600 doses would arrive on March 1, only for this to be delayed to March 4 due to supply and logistical problems, which resulted in only 487,200 doses landing in the country.Speaking to health workers at the Ospital ng Parañaque, Galvez said all 525,600 doses did not arrive at the same time because a commercial plane was used for its delivery.      The Philippines expects to receive up to 9.2 million doses of AstraZeneca’s coronavirus vaccine this year through the COVAX facility, which ensures that developing countries get access to the coveted drug.The doses from the COVAX facility is on top of the 17 million procured by the national government, local governments and the private sector, which are expected to arrive later this year.AstraZeneca’s shot, which has secured emergency use approval from the Food and Drug Administration, is found to be 70% effective on average and only need to be stored at standard fridge temperatures of 2°C.A member of the private research firm OCTA, however, warned that the shot’s efficacy could decrease to just 10% against the new coronavirus variant first identified in South Africa — 58 cases of which have already been detected in the Philippines.The health department sought to soothe those fears, saying that the studies cited only used a small sample of individuals, although it did say that the variant from South Africa, known as B.1.351, “may have an impact on vaccine efficacy.”The World Health Organization stands by the use of AstraZeneca vaccine after a preliminary study suggested the jab offered less protection against B.1.351."
9,9.0,9.0,9.0,9.0,,https://www.philstar.com/cebu-news/2021/03/06/2082453/city-chooses-astra-covovax,Caecent No-ot Magsumbol,"March 6, 2021 - 12:00am","City chooses Astra, Covovax","CEBU, Philippines — Cebu City has submitted letters of intent to purchase COVID-19 vaccines from AstraZeneca and Covovax.“Ato nang gipada sa duha, AstraZeneca and Covovax,” said Mayor Edgardo Labella yesterday.The city sent the letters after the City Council authorized Labella to do so. Vice Mayor Michael Rama, the city’s vaccine convenor, presides over the Council.      The city chose AstraZeneca and Covovax for their efficacy and cost, as well as storage consideration. AstraZeneca already has an Emergency Use Authorization from the country’s Food and Drug Administration. Covovax’s EUA is still pending.Labella said this is not the first time that the city communicated with AstraZeneca but this is the first time that it formalized its intent with the Council authorization. Negotiations are being handled by Rama and the city’s vaccine board.      Initially, the city government will use P100 million of its P400 million budget for vaccines.&nbsp; It will purchase more depending on the progress of the national government’s orders and will add budget when necessary.The city is also open to purchasing other vaccine brands, but only after these brands can get an EUA.In an earlier report, Sinovac is among three vaccines the city has considered for its own vaccination program. However, it decided to let go of Pfizer-BioNtech, the first vaccine to be given an EUA in the country, mainly due to storage concernsLabella said he will have himself vaccinated, as long as it is safe for senior citizens, as soon as the vaccine arrives.“Ako, magpabakuna gyud ko because this is the one of the ways that we can go back to normal,” Labella said.He said the city can also hold its own simulation of the vaccination program just like what Lapu-Lapu did.Based on the March 4, 2021 data from the Department of Health (DOH)-7, Cebu City has 3,316 active cases with 143 more logged that day. — JMO (FREEMAN)"
10,10.0,10.0,10.0,,,https://www.philstar.com/headlines/2021/03/05/2082189/top-covax-donors-us-eu-welcome-arrival-astrazeneca-jabs-philippines,None,"March 5, 2021 - 3:17pm","Top COVAX donors US, EU welcome arrival of AstraZeneca jabs in Philippines","MANILA, Philippines — Major contributors to the World Health Organization co-led COVAX facility welcomed the arrival of AstraZeneca vaccines in the Philippines.After delays, 487,200 doses of the vaccine produced by the Swedish British drugmaker arrived in the country on Thursday night.   Related Stories      After delays, first AstraZeneca jabs from COVAX arrive in Philippines   Distribution of AstraZeneca COVID-19 vaccines to hospitals may begin Friday — officialBoth the United States and the European Union welcomed this latest development.      The US Embassy in Manila said it has initially donated P97.2 billion ($2 billion) to COVAX ""to ensure the Philippines and other countries receive COVID-19 vaccines.“The United States is proud to be the largest contributor to COVAX, and we welcome the successful arrival of the first tranche of AstraZeneca vaccines in the Philippines. As we fight the pandemic together, the United States will continue to support the Philippines’ vaccination and COVID-19 mitigation efforts,” US Chargé d’Affaires John Law said in a statement released Friday.      In February, the US pledged to donate a total of P194.4 billion ($4 billion) to the COVAX facility to help the world's most vulnerable and at-risk populations in getting COVID-19 vaccines.Team Europe, consisting of the EU and its member states with the European Investment Bank, meanwhile said it has to-date provided P130 billion (€2.2 billion) to COVAX.EU Ambassador Luc Véron highlighted that the Philippines will receive vaccines for 22 million Filipinos under the COVAX facility.""The EU has both a responsibility and interest to make vaccines available to all. The European Union has maintained its goal to work in solidarity for vaccine cooperation and multilateralism — none is safe until everyone is safe,"" Véron said Thursday.According to one of the officials leading the country's pandemic response team, the government may start distributing the AstraZeneca jabs on Friday or Saturday.“Maybe the distribution of AstraZeneca vaccine to different hospitals will begin either later today or tomorrow,” Vince Dizon, deputy chief implementer of the National Task Force Against COVID-19, said in an interview on Teleradyo. —&nbsp;Patricia Lourdes Viray with report from Gaea Katreena Cabico"
11,11.0,11.0,11.0,,,https://www.philstar.com/headlines/2021/03/05/2082164/distribution-astrazeneca-covid-19-vaccines-hospitals-may-begin-friday-official,None,"March 5, 2021 - 10:16am",Distribution of AstraZeneca COVID-19 vaccines to hospitals may begin Friday — official,"MANILA, Philippines — The government may start deploying close to 500,000 doses of the COVID-19 vaccine developed by British Swedish firm AstraZeneca and Oxford University to different hospitals nationwide late Friday, an official leading the country’s pandemic response said.“Maybe the distribution of AstraZeneca vaccine to different hospitals will begin either later today or tomorrow,” Vince Dizon, deputy chief implementer of the National Task Force Against COVID-19, said in an interview on Teleradyo.Skip   Related Stories      AstraZeneca jabs being eyed for elderly medical personnel, officials say   After delays, first AstraZeneca jabs from COVAX arrive in PhilippinesIn a separate interview on CNN Philippines, Dizon said the rollout of AstraZeneca jabs will&nbsp;“start immediately.”      After delays, some 487,200 doses of AstraZeneca obtained through the COVAX facility arrived in the Philippines Thursday night. The number of doses was lower than the 526,000 that the government expected to receive last Monday.The Philippines is expected to receive 4.58 million doses of the AstraZeneca vaccine from COVAX facility along with 117,000 doses of the vaccine developed by Pfizer-BioNtech.      Dizon, who is also the country’s testing czar, said hospitals that received donated Sinovac jabs will also receive AstraZeneca shots.“They will also receive [AstraZeneca] because both will be rolled out simultaneously based on the order of the president so medical frontliners will have a choice,” he said.Vaccine czar Carlito Galvez Jr. earlier said the government aims to vaccinate between 1.7 million and 2 million health workers by end-March. But it faces challenges not limited to the stock of the coveted jabs but also the reluctance of the public to get inoculated.“So every vaccine that comes in, regardless of brand, would be for them. So hopefully by end of March or April, we could vaccinate all our healthcare workers,” Dizon said.&nbsp;The government is eyeing to administer the AstraZeneca vaccine to elderly medical personnel. Sinovac, the only vaccine currently being rolled out, is only recommended by the National Immunization Technical Advisory Group for people aged between 18 and 59 years.The World Health Organization stands by the use of AstraZeneca vaccine despite a preliminary study suggesting the jab offered less protection against the variant first seen in South Africa, its representative to the Philippines said Thursday. The country has so far detected six cases of B.1.351.To date, the Philippines has recorded over 584,000 COVID-19 cases, including more than 12,000 deaths. — Gaea Katreena Cabico"
12,12.0,12.0,12.0,,,https://www.philstar.com/nation/2021/03/05/2082163/covid-19-frontliners-elated-sinovac-jabs-arrive-barmm,John Unson,"March 5, 2021 - 9:55am",COVID-19 frontliners elated as Sinovac jabs arrive in BARMM,"COTABATO CITY, Philippines —&nbsp;Anti-COVID-19 frontliners in the Bangsamoro region were elated with the national government’s supply of 2,100 doses of Sinovac to protect them from the infectious disease, which has so far infected&nbsp;584,667 in the country.Physician Amirel Usman, acting health minister of the Bangsamoro Autonomous Region in Muslim Mindanao, said Friday the vaccines are intended for health workers and essential service providers in the forefront of BARMM’s war on COVID-19.“Our frontliners are happy with this,” he said.      Usman and physician Zul Qarneyn Abas, also a senior official of the Ministry of Health-BARMM, led the medical team that fetched from the Maguindanao Airport&nbsp;the vaccines that arrived from Manila, brought in by a passenger plane.Usman said the shipment consisted of 4,200 vials of Sinovac.      The 4,200 doses are for 2,100 anti-COVID-19 frontliners in the Bangsamoro region, who shall have two jabs each.The MOH-BARMM and the Rapid Emergency Action on Disaster Incidence, or READI contingent, are working together in pushing the anti-coronavirus containment efforts of the Bangsamoro government forward.“This shall be the initial stage of our vaccination program in the Bangsamoro region,” Usman said Thursday.He said the vaccines that arrived Thursday are intended for 1,400 frontliners in Maguindanao, 972 in Lanao del Sur, 287 in Basilan, 1,032 in Sulu and 518 in Tawi-Tawi.Lawyer Naguib Sinarimbo, BARMM’s local government minister, said Thursday the Bangsamoro leadership is thankful to the national government for supplying vaccines for 2,100 regional anti-COVID-19 frontliners.“We are so thankful for this support,” Sinarimbo, also BARMM’s regional spokesperson, said.Sinarimbo is overseeing the operation of READI that has teams of calamity and disaster response experts directly involved in BARMM’s anti-COVID-19 campaign.A number of BARMM-READI personnel survived COVID-19 infections last year, apparently contracted while working in the field."
13,13.0,13.0,13.0,,,https://www.philstar.com/nation/2021/03/05/2082035/quezon-city-health-workers-get-vaccine-jabs,Janvic Mateo,"March 5, 2021 - 12:00am",Quezon City health workers get vaccine jabs,"MANILA, Philippines — Physician Amie Guzon, head of the family medicine department of the Quezon City General Hospital (QCGH), could not contain her excitement after receiving the first dose of the vaccine developed by Sinovac of China on Wednesday.“It marks the start of the end of the pandemic,” Guzon told reporters during the rollout of the vaccines for QCGH personnel.Guzon, who is a COVID survivor, was among the first five medical frontliners who received one of the 300 doses of CoronaVac allocated to the city-operated hospital.      “This completes the whole cycle of my pandemic,” Guzon said, citing her experiences as the manager of the HOPE quarantine facilities established by the local government and as a COVID patient. “I hope that other health workers and my family are proud of what I did for them.”According to Guzon, she never hesitated about getting the China-made vaccine instead of the Pfizer vaccine.      “Any vaccine will do rather than zero vaccine,” she said. “I have experienced the whole cycle of the pandemic... We are going in circles. This is the only thing that will stop the cycle of COVID.”When they first made a survey on who were willing to get inoculated with CoronaVac, QCGH director Josephine Sabando said only three out of over 1,000 personnel answered in the affirmative.Most of the hospital employees were willing to wait for other vaccine brands, Sabando said.Mayor Joy Belmonte admitted that she was initially dismayed when she heard that only a handful were willing to receive the vaccine developed by Sinovac, which was granted emergency use authorization by the Food and Drug Administration.Belmonte lauded Sabando for convincing more medical personnel to get vaccinated with Sinovac.Sabando said 300 doses of Sinovac received by Quezon City have been allocated, with more on the waitlist.The hospital director said she organized town hall meetings where she presented data about the efficacy of Coronavac, especially for severe COVID cases.“It prevents mild cases of COVID-19 by 50.4 percent. For moderate, it is 78 percent. But for severe, it is 100 percent similar to AstraZeneca,” Sabando said.“With this vaccine, we are preventing moderate to severe cases among our healthcare workers. Once vaccinated, there will be almost complete protection from hospitalization, intubation, even death,” she added.Sabando underscored the importance of vaccinating health workers as soon as possible, citing the surge in the number of COVID-19 cases in Metro Manila.Belmonte expressed gratitude to the frontline workers who consented to receive the China-made vaccine.“This is a milestone in our COVID-19 response. We have begun the vaccination starting with our health workers,” she said.“I want our doctors and healthcare workers to be protected in any way possible. This vaccine is the best right now considering that this is what is available to us,” she added.The QCGH targets to inoculate 100 people per day."
14,14.0,14.0,14.0,,,https://www.philstar.com/nation/2021/03/05/2082037/more-provinces-get-sinovac-vaccines,Edith Regalado,"March 5, 2021 - 12:00am",More provinces get Sinovac vaccines,"DAVAO CITY, Philippines — More provinces received their supply of Sinovac vaccines from China yesterday.At least 17,400 doses for Northern Mindanao arrived at the Laguindingan airport in Cagayan de Oro City.An additional 21,600 doses arrived at the airport in this city at around 7 a.m.Skip      At least 12,000 and 4,000 doses of the vaccines were delivered to Legazpi City and Cotabato City, respectively.This city, which received an initial 16,000 doses on Wednesday, will roll out its vaccination program today at the Southern Philippines Medical Center.      The vaccine rollout in Cebu City was held at the Vicente Sotto Medical Center yesterday.In Ilocos, 14,400 doses of Sinovac vaccines were brought to the cold storage facility of the Department of Health (DOH) Center for Health and Development regional office in San Fernando, La Union.DOH regional director Valeriano Lopez said 7,000 health workers would be initially inoculated.In Negros Occidental, 3,200 doses of Sinovac vaccines were alloted for the Corazon Locsin Montelibano Memorial Hospital and Riverside Medical Center in Bacolod City.Meanwhile, in Bulacan, Mayors Ferdie Estrella of Baliwag and Maria Rosarioi Ochoa-Montejo of Pulilan allocated funds for the procurement of Oxford-AstraZeneca’s COVID-19 vaccines.In Bataan, 2,736 frontline workers have registered for the vaccination program. – Ramon Efren Lazaro, Ric Sapnu, Gilbert Bayoran, Raymund Catindig"
15,15.0,15.0,15.0,,,https://www.philstar.com/headlines/2021/03/05/2082088/vaccine-rollout-reduce-risks-prolonged-pandemic,Louise Maureen Simeon,"March 5, 2021 - 12:00am",‘Vaccine rollout to reduce risks of prolonged pandemic’,"MANILA, Philippines — An effective mass vaccination program is expected to lessen the economic risks for countries experiencing prolonged effects of the pandemic, the Asian Development Bank (ADB) said.In a joint webinar of ADB and the Johns Hopkins University yesterday, ADB president Masatsugu Asakawa maintained that economies of most of developing Asia, including the Philippines, will rebound this year to as much as 6.8 percent from the 2020 contraction of 0.2 percent.The Philippines is expected to turn in a 6.5 percent gross domestic product (GDP) growth for 2021.      However, the availability of vaccines will significantly affect the road to economic recovery.“Risks of a prolonged pandemic are tempered by vaccine developments and rollouts though progress on this front varies across economies,” Asakawa said.      “COVID-19 vaccines give us hope that we can gradually turn the tide and rebuild our economies,” he said.Vaccine rollout in the Philippines, however, was the last to materialize in the Southeast Asian region.As of March 3, only 756 doses have been administered in the country, or 0.0002 percent of the 265 million doses globally. It is miles away from the vaccination progress in its ASEAN neighbors like Indonesia which has so far rolled out 2.69 million doses, Myanmar with 104,664 doses and Cambodia 33,211 doses.Generally, developing Asia is much behind in vaccination compared to the US and Europe. ADB principal health specialist Eduardo Banzon said a lot of factors can explain the slow progress.“There’s problem on cold chain logistics for the vaccines and this is adult vaccination. Most of the countries are used to childhood vaccination, it’s a little different now,” Banzon said.“It’s a campaign type and shifting to campaign mode for the next six months or so would be challenging. Vaccine hesitance is a problem but not a problem that cannot be solved,” he said.ADB chief economist Yasuyuki Sawada, for his part, emphasized that vaccine rollouts – from procurement to deployment to confirmation of effectiveness – will shape every country’s reopening and recovery this year.“Vaccine roll out is very critical in deciding and reopening of each country,” Sawada said.Meanwhile, presidential spokesman Harry Roque denied insinuation by administration critics that President Duterte was setting the bar low when the latter said the country would achieve normalcy only by 2023. “Well, you know that going back to normalcy is anyone’s guess,” he said.He explained the President’s statement was logical since some experts have said that the country might attain “herd immunity” only a year after a vaccination kickoff.He said if the country completes its vaccination program this year, it will only be by 2022 that herd immunity could be established to signal a return to normalcy.Roque said the government is working doublly hard to restore the public’s faith in the vaccine and the economy.“I don’t think there is a chilling effect on consumption. Why? As the President has said a vaccination program will only have to take off and attract many people for him to decide on opening everything,” he said. – Christina Mendez"
16,16.0,16.0,16.0,,,https://www.philstar.com/headlines/2021/03/05/2082122/duterte-happy-vaccine-rollout,Alexis Romero,"March 5, 2021 - 12:00am",Duterte happy with vaccine rollout,"MANILA, Philippines — President Duterte is happy with the rollout of COVID-19 vaccines, but wants to see a more massive inoculation so he can be confident of relaxing quarantine restrictions in the country, Malacañang said yesterday.“He said he really wants to (loosen the restrictions). The first thing is that he’s very happy with the rollout, with what’s happening in the rollout. He wants to see more happening as a challenge to all of us. Perhaps he wants to see a more massive rollout,” Cabinet Secretary Karlo Nograles said.Simultaneous vaccine rollouts would be held in the Cordilleras, Ilocos, Central Luzon, Calabarzon, Mimaropa, Bicol, Western Visayas and Eastern Visayas on Monday.      Since Monday, Philippine Airlines has airlifted 55,200 doses of Sinovac vaccines to Cagayan de Oro, Davao, Legazpi and Cotabato on four different flights.Upon arrival, the vaccine were loaded into cold-storage vans and delivered to various hospitals in preparation for regional vaccination drives.      Loosening restrictionsAnd because of the expected arrival of vaccines from both the COVAX facility and Chinese drug-maker Sinovac, Nograles added that it’s possible to place the entire country under the most lenient modified general community quarantine or MGCQ.Around 9,077 persons have received vaccines in 10 Metro Manila hospitals so far, with the government allotting 3.7 million vaccine doses solely for healthcare workers.The Armed Forces of the Philippines confirmed that 2,290 military health personnel have been inoculated in five sites during the first four days of vaccination.For the Philippine Coast Guard, commodores Fran Eden and Luz Escarilla, the first women doctors to reach the rank, expressed willingness to receive the Sinovac vaccine.AdChoicesADVERTISINGBreach in protocolMeanwhile, Malacañang admitted yesterday that protocols were breached when Interior Undersecretary Jonathan Malaya, Metropolitan Manila Development Authority public services head Michael Salalima and Quezon Rep. Helen Tan were vaccinated despite the policy prioritizing healthcare workers.“We are not perfect in implementing protocol, we had breaches but we learned from it and now, everyone knows it’s medical frontliners first,” presidential spokesman Harry Roque said.National Task Force chief implementer Carlito Galvez Jr. said the breach in prioritization protocols merits a probe.“There are no directives like that. That’s wrong, what we have is all medical frontliners, the 1.7 million (medical) frontliners would be prioritized for now. We don’t have enough vaccines… we will investigate that just in case there was indeed an occurrence like that,” Galvez said.On the other hand, Tan denied receiving special treatment and argued she received the vaccine slot through her son, a surgeon at Veterans Memorial Medical Center.“I would like to ask the public not to perceive this as VIP treatment, since it is totally false and misguided, inasmuch as I am a legal dependent, an immediate family member of a frontliner working as a medical professional at the VMMC,” the congresswoman, a doctor by profession, lamented. — Rudy Santos, Romina Cabrera, Robertzon Ramirez, Edu Punay, Michelle Zoleta, Tina Mendez, Neil Jayson Servallos"
